Tags,Title
microservices,RangeError: Invalid status code: undefined at new NodeError (node:internal/errors:371:5)
iot,Iot Devices and buffer size
security,How to prevent user for manipulate / change value of variable in browser?
algorithm,All Possible Combinations of a list of Values
microservices,Communicating Go Microservice with Java Spring Microservice
machine-learning,PyTorch learning scheduler order changes loss in a drastic way
algorithm,Finding Minimum Spanning tree using Prim Algorithms and display edges of Minimum spanning tree?
security,Permission on session files created by .net core inside /tmp/.dotnet/shm are too open
machine-learning,Word2VecKeyedVectors&#39; object has no attribute &#39;index_to_key&#39;
operating-system,Android: Automatically modify metadata of any new file(s) saved or downloaded
web,Login Failed on localhost:3000 using Node.js and mySQL
security,Securing Connection string in App.Config and web.config in ASP.NET MVC while deploying Azure web app
machine-learning,what is the difference between database search technique and machine learning search technique?
database,Spring Boot Reactive Database operation only works in a debugger
database,How to keep track of a table data-change migration on Ruby on Rails
security,Blazor WebAssembly Application fails to load due to integrity errors
database,Database Design - storing multiple email per user
web,Hey ! Integrate a little box status of my Minecraft Server on my website
security,Server-Side Request Forgery Fortify Fix c#
microservices,AWS ECS- Task exited automatically with an exit code 0
web,Random css showing up on all pages I visit
operating-system,Can PWA listen in on OS events?
operating-system,How to remap virtual memory to other adress in virtual memory in xv6?
algorithm,projecteuler problem 8 - unsure on what is wrong with my code
security,Error InSMTP server requires a secure connection
security,How to sign a SQL Server assembly created with assembly_bits / hex bytes?
operating-system,Unable to create and save files to a directory on a Linux VPS in a Python code for telegram bot
microservices,How to use authorization in Gateway for a .NET microservice based app using Ocelot
database,Submitting data to a table in access database through a shiny app
security,how to prevent docker from mounting certain locations as volumes?
machine-learning,PyTorch UNet semantic segmentation dice score more than 1
machine-learning,creating a document classifier via Quantum Machine learning and the classification isnt correct
iot,How do we parse an NDEF message?
security,Can OAuth2.0 prevent non-approved native applications from impersonating an approved application?
operating-system,arm cortex m4 xPSR change when branching
security,password is empty on login symfony 5.3
machine-learning,Mixing video and data streams on raspberry pi for machine learning
security,How to detect malicious script of a svg file in spring boot?
database,create a new variable based on other using R
machine-learning,Keras - Error occurred when finalizing GeneratorDataset iterator
machine-learning,How to implement predict_proba from scratch (multiclass)
database,`text` no longer populated in Messages chat.db database in MacOS 13 Ventura?
web,My wordpress website Home Page gets scattered
security,"Keycloak, First Broker Login: if no account exists ask user to link to an existing account or create new"
iot,overhead of changing sensor sampling time
operating-system,Why os.path.realpath doesn&#39;t work properly
iot,Kafka cluster security for IOT
algorithm,"Algorithm: Given an array, find the maximum sum after rearrangement"
algorithm,generate all permutations of nxn grid of s options
algorithm,confused about dynamic programming state
security,"how to check permission on a document whether it has any update/read permission or not, if there is no permission on the document in marklogic?"
web,Create a class for Google API wallet in PHP
web,Uncaught TypeError: Cannot read properties of undefined (reading &#39;components&#39;) in pure JS app
operating-system,How can I safely create a nested directory?
algorithm,how to split an iterable in constant-size chunks
security,This document requires &#39;TrustedScriptURL&#39; assignment
security,Next.js Protect Routes Which Use Static Site Generation
machine-learning,How can I solve &quot;NameError: name &#39;ArffDecoder&#39; is not defined&quot;?
database,"Getting syntax error when using CASE to check if column is more than 0, else use other column"
iot,AWS Boto3 IoT - How to get the content of a certificate of a thing
microservices,Is it possible to replicate tables from multiple databases in Google Cloud?
microservices,Java Service require a bean (Interface)
iot,Proxy in between device and Google IoT Core using MQTT?
operating-system,google-compute-engine resize disk is now empty and has the wrong OS. Also SSH is broken to the server and three websites are down. How to fix it?
microservices,Slowing down redis via proxy
algorithm,Find k-th minimum sum of every possible subset
iot,Connection refused: Identifier rejected when try to connect with MQTT broker
microservices,There is no matching message handler error in NestJs TCP E2E test
microservices,How to solve the data loss issue in Event Emitters in NodeJS? MicroServices
machine-learning,Clustering time series data in Python
iot,Sending a fetch request while connected to an iOT device without internet
security,Iot device and Django rest framework back-end security
security,How to detect IPA Patcher?
operating-system,How to execute certain command on Windows program?
machine-learning,How do I find out how LogisticRegression in sklearn classified my test data?
machine-learning,How to generate predictions on testing triplets dataset after training Siamese network
machine-learning,Feature elimination to screen for multiple models using tidymodels
microservices,Problem with Azure in Microsoft learning path module (Kubernetes)
algorithm,"Between redis bloom and cuckoo filters, which is better in terms of performance?"
iot,MSP430 compiler not found when using Contiki-NG
security,Java 7 support of AES-GCM in SSL/TLS?
web,"ipynb running on a website, sending pyplot graphs"
iot,"How to fetch a IoT streaming data from AWS cloud, and after some operations on retrieved data, tranfer it back to another cloud?"
web,how to send text box value to the specific url in c# without java script?
algorithm,How to detect the amount of almost-repetition in a text file?
database,When Getting Data from the API and how Saving it Into Sharepreference?
algorithm,Find the missing value of array which have specific pattern
microservices,Design advice for restful darts-game communication
algorithm,Dynamic programming - basic algorithm
web,How to programmatically load whole facebook profile at once?
iot,IoT Python application architecture with Flask on Raspberry Pi
microservices,Can we allow an API to work using MessagePattern and Rest method as well in NestJS?
database,Maintaining Deployed Postgres Database with Prisma
microservices,Azure service fabric with dotnet core and linux system
algorithm,Dynamic programming - basic algorithm
machine-learning,"Reversing Sci-Kit LabelEncoder, but have a 2D array dataset"
web,Question about browser debug window(F12) --- why do I always see a couple of each API call in debug window?
web,styling css by confdition from the backend
web,A function that is defined inside the methods{} is showing an error when it is called outside
security,how to migrate away from FOSUserBundle in Symfony 6
security,"How would you structure a webapp so that users don&#39;t need to sign in, but they still have a unique identifier that only they can use?"
operating-system,Installing Flutter using Homebrew
database,How to use Materialized View in XML database?
microservices,Can we share the same database but different tables between micro services
database,Unable to restore mysql database via Jenkins Pipeline
operating-system,"The $Path from Sys.getenv() is different from what I get from CMD, and cannot be changed"
database,Importing raw SQL queries into server.js
web,How can I load an image without use html?
iot,Force Android to Use Wifi network with no internet
microservices,RestTemplate: While calling an API from one localhost to another i get error
iot,Raw http server: send image issue
database,query elasticsearch from python
security,Why can you load a local Javascript file and not a local JSON or XML file?
iot,Looking for a Bosch XDK IoT coding guru for upcoming project. Any suggestions?
iot,Want to convert Decimal from signed 2&#39;s complement to hexdecimal without signed 2&#39;s complement (ex : -73 -&gt; B7)
database,How to deep fetch In Strapi cms compnents?
algorithm,How to traverse a graph with algorihtm
iot,Programmatically declare a parent-child relationship between the devices in IoT Hub using Node SDK
microservices,Is circuit breaker pattern applicable for asynchronous requests also?
algorithm,What is the time complexity of using max heap to solve &quot;Find the K-th largest number in the array&quot; problem?
web,Java Annotiation name
algorithm,Check for Valid Parentheses in java
microservices,RestTemplate: While calling an API from one localhost to another i get error
web,"ul tag with circle is done in react js,but it is not working with show circle why?"
machine-learning,Why is my code printing separate dataframes instead of just one in Python?
algorithm,How to find smallest substring which contains all characters from a given string?
database,Select on tag return nothing in CnosDB
security,How to creat snort rules on windows
web,Blog Post Title Not Getting The Link Of Single Post Page(WP Bakery Builder) Wordpress
machine-learning,How to speed up Recursive Feature Elimination with RandomForestClassifciator?
machine-learning,Neural network Prediction becomes a straight line
microservices,How to split a monolith automatically during deployment
operating-system,Why are user processes responsible for requesting memory from the OS?
database,Supabase: Solutions for column-level security
machine-learning,Cross Validation with coco data format json files
security,How can I run Javascript on Django without exposing static files?
algorithm,Exploring an algorithm to approximate minimum N concentration of an area
security,API Authorization Tool
microservices,Using the auth filter in an api gateway Spring boot
operating-system,grapheneos build with custom bootanimation
microservices,versioning microservices developed using Serverless framework
database,Autovacuum Triggered for transaction wraparound for a table even with increased autovacuum_freeze_max_age at table level
security,web application secure forget password implementation
iot,uPLibrary.Networking.M2Mqtt.MqttClient throwing CommunicationException and OutOfMemoryException
iot,How would I implement high availability across regions for Azure IOT hub?
algorithm,How to find all partitions of a multiset (a set that allows duplicates)
web,Customization of Login Page Cognito
operating-system,Arrival of message in child process is not displayed
web,What is the right way of adding own JS to a React App?
operating-system,Is there a way to remove text from path in makefile
operating-system,Please explain the following characteristic of suspended process
iot,IOT - Error : LEDC is not initialized Nodemcu ESP32 in wokwi
database,Anyway to autocomplete fields in a form for access?
operating-system,Monitor not showing the right memory usage
iot,Mosquitto - subscribe to one broker and push to another using C
security,How can an organization query Azure DevOps API to get a list of all users&#39; associated projects and/or teams?
security,Getting the Spring Security &quot;JWT Login Sample&quot; to work with roles
microservices,How to communicate between services in Kubernetes in a secure way
iot,How can I access device configuration from an EFENTO COAP loader on a server?
machine-learning,Is Google&#39;s ML Kit available outside of Android?
web,Creating auditory ripples efficiently in the browser
iot,TDengine How to Check If Database Parameter Modification is Effective
iot,why the first node has less data than other nodes in TDengine cluster
microservices,Registering to Eureak Service is taking long time
microservices,Microservices dependencies in UML diagrams
operating-system,"Clarification of process scheduling, thread scheduling, CPU scheduling in preemptive multitasking operating system"
machine-learning,What method to use for clustering different CPU usage pattern?
machine-learning,How can I continue Latin Hypercube Sampling in Python?
security,How to whitelist only a few URLs to make API calls at client site?
database,How to call a PostgreSQL stored procedure with Hibernate
database,django admin error target lists can have at most 1664 entries
database,Capture the column causing ORA-01438: value larger than specified precision allowed for this column
security,Sending vital security values to my github
operating-system,Build an OS and emulate it on qemu
web,Windows - Create shortcut that C&amp;P selected text automatically to web app Deepl
iot,How can I run Prometheus on my local network for IoT?
security,upgrade saml over spring security. override by configuration in web.xml
microservices,Web APIS and Microservices
database,Prevent continuously adding columns by postgres json data type
security,The requested operation cannot be completed due to security restrictions
iot,How to do data buffering in a GSM IoT gateway made using STM32 and SDcard
database,error &quot;binding parameter 0 - probably unsupported type&quot;
web,Is it possible to connect c++ to mysql and then make that into a wasm file for javascript use?
iot,"Azure IOT Message Body, ContentEncoding Method not found"
iot,IoT lifecycle events handling
database,save image in public folder instead storage laravel 5
iot,get iot device shadow from http rest
machine-learning,How to plot ROC curves based on mean and standard deviation in python?
security,How to implement role based login using SAML
database,Approach to storing forecast time series data using python
algorithm,Time complexity of an algorithm that runs 1+2+...+n times;
algorithm,"How to find the correct &quot;word part&quot; records that make up an input &quot;word string&quot;, given a word part dataset?"
security,Facebook Messenger Verify X-Hub-Signature of Shared Location
web,yii:format array of number
iot,IoT Industrial Cloudless Architecture
database,Job scheduler application (Node JS or Python)
database,Which is the best database for file system hierarchical data with millions of writes?
operating-system,Make the drag N drop file copy it into my python directory
algorithm,"Given array of elements, count number of subsequences of length &#39;k&#39;, which form a Geometric Progression with given ratio &#39;r&#39;"
database,ORA-02065: illegal option for ALTER SYSTEM with _allow_insert_with_update_check
microservices,Can we use server sent events in nestjs without using interval?
operating-system,Changing file permissions in inodes while a user has the file open
algorithm,Divide an image by grouping similar pixels into rectangles
machine-learning,How to get the roc auc score for multi-class classification in sklearn
database,Cannot update or save data on second or next user in mongodb
web,Save image from html to phone photo directory
web,Why doesn&#39;t Burp Suite load the site?
security,possible to restrict iOS app&#39;s network connections or to enumerate them?
database,Unable to establish correct parent-child relationship in sql
microservices,How to deal with shared state in a micro-service architecture?
algorithm,The elegant way to resolve negative zero in Javascript
security,Securely pass the x509 certificate&#39;s password to X509Certificate2()?
iot,Use Elastic Search to store data values sent by IOT devices in a period of time
iot,Create AWS IoT solution to filter incoming data and send response to Web App in real time
iot,ResourceRegistrationFailureException when calling the RegisterThing operation - thing groups conflict
microservices,Reactive support for feign cleint
algorithm,The elegant way to resolve negative zero in Javascript
database,Select NULL Values in SQLAlchemy
algorithm,Toggling properties using recursion | Checkbox tree
web,Public web tool to show request body
iot,C# .NET 5 Break beam sensor Raspberry PI
iot,Web bluetooth sending and receiveing issue#2
microservices,How can I avoid reprocess duplicate messages in a pub/sub when the k8s make HPA?
microservices,How to publish to and consume from other rabbitmq exchange in nameko service?
security,Firebase Admin SDK security best practice for push-notifications
operating-system,How to detecting mobile operating system (Android/ios/iPadiOS) in net core or net standard 2.0
microservices,.Net Core Micro-Service Test Automation
machine-learning,Why doesn&#39;t the transformer use positional encoding in every layer?
database,Taking over dotnet core project and have question about EF Core ORM
iot,Upload certificate in Azure device provisioning service
security,"NVD JSON feeds, tags meaning and their purpose"
microservices,How can I avoid reprocess duplicate messages in a pub/sub when the k8s make HPA?
machine-learning,Will defining a loss in metrics affect the model training?
database,How to write query for this given result?
web,Best way of storing large pre-formatted text to be displayed on a website?
database,How is concurrency managed in output binding for Cosmos DB in azure function?
security,Docusaurus v2 set security headers
operating-system,Making username-independent os.rename
database,Testing kubegres promotion feature
web,S3- Posible to make replica in the same bucket?
web,VueJs - Vuex - Change a state
machine-learning,Tensorflow custom training step fails with &quot;Unexpected result of train_function&quot;
microservices,Configuring open telemetry for tracing service to service calls ONLY
machine-learning,How to change the color of HandConnections in Media pipe?
algorithm,Data structure to find the nearest untaken element
web,Closing dropdown by clicking outside in Javascript (tutorial clarification)
microservices,Why to request info logs generate in Quart but not Hypercorn?
operating-system,calling certain function if context switched (C++)
web,WebAuthn: Can&#39;t create public key. Promise is rejected
iot,Is REST API over SSH possible?
web,Google only indexes logo and hero images. Google hasn&#180;t indexed my post images
security,What does the app&#39;s security assessment say about Encrypted and Stack Exec?
database,GBQ - Get around the Exceeded rate limits issue
operating-system,What if logical address is not present in page table and we are assigned to find physical address for that?
iot,Google IoT Core MQTT Node-red Publish/Read /devices/deviceId/events
microservices,Best approach for communicating between Emailing microservice and others
iot,Streaming Raspberry Pi camera feed with motion detection to a web page
iot,Ixxat CAN@net NT 200: What is the maximum number of configurable messages filters the Generic protocol allows?
microservices,How to build integration platform
algorithm,How to delete the symmetric rows of a matrix stored in long format and in one query?
microservices,Issue with configuring and Sending RPC queries using KubeMQ
algorithm,Heap-sort &#39;Heapify&#39; iterative procedure
machine-learning,Compare similarity of two names and identify duplicates with neural network
machine-learning,Writing predictions back to dataframe pandas
microservices,Duplicate and missing log entries with FluentBit and ES
database,How to find the gap of log sequence applied in Primary and Standby instance?
iot,can&#39;t open source file &quot;sys/reent.h&quot; (dependency of freertos/FreeRTOS.h)
microservices,does not start microservice
algorithm,To read from file and store data in map c++
web,Navigator in Flutter Web without Click Event
machine-learning,How to increase the score in Kaggle competition?
machine-learning,Incorrect Number of Dimensions on Train and Test Dataset
web,How do you find the origin of an event? [VueJS]
microservices,What are the best ways to handle the user data in microservices
operating-system,Paging Calculation in Operating System
security,What is the best plugin to prevent XSS attacks in wordpress
iot,Using AWS IoT Android SDK for MQTT Pub/Sub and Authentication
database,My code for the redisgraph only needed one relationship but it pop out unesessary and duplicate relationship
operating-system,grapheneos build with custom bootanimation
algorithm,Parenthesizing a string so that expression takes a given value
operating-system,How to make pandas and csv work on linux?
microservices,Deploying a spring boot micro service connected to mysql db to an external service on open shift through Jenkins pipeline
algorithm,Creating code which generates random mathematical problem for user to solve. Can&#39;t figure out the algorithm for calculating correct answer
database,Getting ImportError: cannot import name &#39;db&#39; from &#39;flask_sqlalchemy when using github tutorial
iot,MQTT can`t connect to backend AWS IoT core
web,Can not resolve Error: .MixinName is undefined on line
web,How should I keep my website hidden from the general public and give only a few people access to it?
machine-learning,&quot;TypeError: function takes exactly 1 argument (3 given)&quot;
algorithm,Find the smallest positive integer that does not occur in a given sequence
operating-system,Context.startForegroundService() did not then call Service.startForeground()
machine-learning,Iterative patch generation for image segmentation - possible to optimise?
database,Calling Update on entityframework core datacontext but not actually updating the class will give an error on savechanges
algorithm,How to change the numbers in a string in a value of a dictionary?
operating-system,Listen to all interrupts with Python
microservices,java.net.UnknownHostException: Failed to resolve &#39;inventory-service&#39; after 4 queries in Spring Boot and Cloud
database,`text` no longer populated in Messages chat.db database in MacOS 13 Ventura?
machine-learning,How to automatically convert a PyTorch model to a HuggingFace model?
operating-system,How the OS knows when an I/O operation has finished execution?
algorithm,Toggling checkboxes using recursion | Recursion problem
web,How to make a datalist-enabled HTML INPUT with a default value still show alternatives when clicked?
microservices,OpenAPI Swagger Configuration on AWS with Load Balancer
algorithm,Display HashMap content in tree view
web,Python to Save Web Pages
machine-learning,"ValueError: Input 0 of layer &quot;model_1&quot; is incompatible with the layer: expected shape=(None, 5312), found shape=(None, 168)"
machine-learning,How can I convert a custom AttenLayer from keras to Pytorch
web,Do I still need the CAPTCHA in the frontend if I&#39;ve already enabled ratelimiter in the backend?
operating-system,Printing to 0xb8000 not working correctly - osdev
iot,AWS IOT: how to check if a thing exists by name and attribute
iot,About how to properly makefile arm stm32
database,MongoDB using skip and distinct in a query based on values inside an array
iot,SIM7000 - add records to SIM address book
operating-system,Why am I getting incorrect Resident Set Size for a spawned process
web,Do I need to worry about &quot;GET /?author=N HTTP/1.1&quot; in my logs?
web,Flutter grid layout
machine-learning,Why does Octave output $ g = [... ...] $
algorithm,Iterative version of Welzl&#39;s algorithm
machine-learning,Can I install wget on my d drive instead of c drive using jupyter notebook?
security,Security of the OIDC login page with authorization_code flow
operating-system,why my Ubuntu os slow in my 4gb lenovo machine
microservices,CMS for backend developer? ideally leave full control on the backend but facilitate creation of pages/content
iot,Error: 7 PERMISSION_DENIED: The signature of device credential in position 0 could not be verified against any registry certificate
web,Why only the background noises heard when playing video in Chrome on android not people&#39;s voice?
security,Step by step Implementation of Apache Ranger or LDAP for presto security (Opensource)
iot,online platform to store IOT sensor data
iot,How to get information from IP address in CSV
security,Is there a way to secure aws-export.js in react-native?
algorithm,In Kotlin how Immutable parameters affect space complexity if you have to copy the input every time to modify it?
microservices,Self referencing microservice
microservices,How can I split deployments of Django apps in the same project with shared models and database?
operating-system,"ubuntu 10.04 boot script finished, but shell or xwindow not shown"
operating-system,Move specific files to new directory while maintaining original directory structure
iot,How can i connect between Snowflake and IoT Sitewise to share data?
database,Is there a way to create an alert when an Azure SQL Database backup fails?
microservices,How to handle unsent data in microservices
iot,AWS IOT: Get Thing connection status
operating-system,Installing Flutter using Homebrew
security,How to forward Wordpress-authenticated users to an URL on a different website that would be forbidden to the public?
algorithm,Analyzing Time complexity of union-find Algorithm?
algorithm,How can I erase/delete vector of class objects according to some Values
iot,Design usage based billing model for IoT platform
operating-system,How to suppress TASKILL output in python os module
operating-system,Loading global descriptor table causes error
iot,Stream instrumentation data lossless trough non-reliable 4G
iot,UnicodeEncodeError with installing uPyCraft
web,How to stop a for loop that has &quot;include tags&quot; in certain item in Nunjucks?
database,Find the SQL statement in EFCore 3.1
algorithm,"Concert Tickets, sorting and searching problem"
