Tags,Title
operating-system,how do I send a file via bluetooth with python?
security,Do Python or Pycharm have a log of past console output?
security,Row-level security based on IS_MEMBER function
web,How to disable connection to website pages without tls protocol in Ubuntu?
microservices,"Database &quot;C:/data/sample&quot; not found, and IFEXISTS=true, so we cant auto-create it - Error in Spring Boot"
algorithm,Generate or find a shortest text given list of words
database,Elasticsearch response to include items coditionally
iot,thingsboard Dashboard MQTT export to android studio
iot,Suggestion for building portal with smart plug
iot,Azure Iot Rest API Message from cloud to device
security,Prevent hidden sheets in ThisWorkbook to be visible by using a macro and run from another workbook
database,"Laravel Database Schema, Nullable Foreign"
microservices,Better Event centric way to solve request-reply problem in Kafka or any streaming service
web,golang form-data payload is visible
security,Changing default Apache version on Mac OS
iot,How to determine number &amp; size of messages sent by an individual Thing on MQTT
security,CentOS Server : There were 495 failed login attempts since the last successful login
operating-system,How do I get datetime of file in a directory based on datemodified in python?
security,CVE-ID: CVE-2022-29464 - Security Advisory WSO2-2021-1738
machine-learning,How to dynamic training for text classification?
machine-learning,Neural network loss not dropping to expected levels
security,NIFI AUTHENTICATION
web,&lt;video&gt; tag renders differently in mobile and PC
operating-system,Is Mac OS X a POSIX OS?
security,Is it possible to reverse a SHA-1?
microservices,Should I use ory kratos or Ory hydra
algorithm,Maximum Sum of Two Non-Overlapping Subarrays of any length
operating-system,"Why can&#39;t I read multiple HDF5 files from a folder? Meanwhile, I can read a single HDF5 file fine... (Python 3.7)"
algorithm,How to create a matrix with this pattern?
iot,How do I use the data from subscribe part (mqtt)
machine-learning,"ValueError: Input 0 of layer &quot;sequential_2&quot; is incompatible with the layer: expected shape=(None, 256, 256, 3), found shape=(None, 1, 256, 256, 3)"
operating-system,Socket IO NestJS + Dart + linux system connection failure
machine-learning,BlockingTimeSeriesSplit returnd best score nan
machine-learning,self-study: cross-validation by hand in R
microservices,Not Able to use Mongo Db for one to many relation in my ecommerce based microservice
operating-system,Create a Snapshot of current android device state and save it for later restore
operating-system,Linux script for HelenOS says: Script failed: Error Configuring BinUtils
security,blacklist IP in kubernetes security policy
microservices,How to organize git repos and docker in a multi service system
database,Prepare stament for creating table not working for mysql
operating-system,Determining Whether a Directory is Writeable
database,SQLite - Count of reports per team per month
database,connecting sql developer with remote oracle database
database,How can I get the data I will use in my quiz game from the Wordpress website?
microservices,There is no matching message handler error in NestJs TCP E2E test
security,Dependency tracker marks activemq-broker as vulnerable
machine-learning,"I am new to pytorch , why am I getting the attribute error even after adding super(ClassName,self).__init__()"
database,IS THERE A WAY I CAN SORT WITHOUTHAVING THIS ERROR ON MYSQL
security,How do I store and retrieve credentials from the Windows Vault credential manager?
algorithm,How multiple recursion works?
machine-learning,What are some ways to figure out why your neural network classifies your data the way it does
operating-system,Why segmentation fault is not thrown when I free the local variable pointed to NULL
web,flashplayer is required and I can&#39;t get it
algorithm,Calculate maximum Arc radius between 2 angles
machine-learning,"Real-time data capture from unstructured invoices, bills &amp; receipts"
security,Session anti-affinity in Kubernetes
security,Pre Hardened Docker Container Images
security,Security &amp; Pyscript
web,Typekit Css gets Blocked
microservices,Problem with Azure in Microsoft learning path module (Kubernetes)
algorithm,Algorithm to traverse graph with certain dependency/constraint
security,strategies to create centralized storage for SSL/TLS certificates on AWS
iot,react native ble manager reading battery percentage
iot,How to deal with big query error 403: quota exceeded?
web,Wordpress.org or wordpress.com for developing a dynamic website
database,How to import data from CSV file to MySql table only for selected columns and CSV has both values enclosed with &quot; &quot; and not enclosed with &quot; &quot;
database,create some notification data based on user level
database,How to add an Identity sequence to an existing column in Hana?
web,removing previous marker before adding new marker in Mapbox
machine-learning,Do Layer Normalization in Pytorch without learnable parameters?
web,Wordpress installed as per the guidelines but website fails to come up even though Apache2 is running. All the word[press files are available in html
microservices,Something went wrong while running your scripts. Check Postman Console for more info
iot,Azur IoT Edge Hub fails to start
database,The type or namespace name &#39;SQLConnection&#39; could not be found
iot,SIM800C Stack Busy Error code 604 while using M2M Vodafone SIM
security,How can I throttle user login attempts in PHP
algorithm,Print power of string/array
machine-learning,confusion in calculation of e-t terms in ARMAX model Python
security,Why is there no preflight in CORS for POST requests with standard content-type
database,Insert existing database file in project using C#
operating-system,What difference between MAC OS X and Linux process control block (PCB)
security,Do I need to filter for protection echo $ _GET in html
security,Is there any part of JWT Keycloak token which can be used as a unique ID of the token itself?
security,Is Django 500 error Invalid HTTP_HOST header a security concern?
algorithm,"Minimum absolute difference of two arrays, at most one replacement"
algorithm,Identifying local highs in a chart
operating-system,Android Display App Which Needs To Run 24x7
database,Which database is better to use in gcp for a static application
operating-system,"Move file after creation, PyPDF2, Pandas, merge.write"
security,migrating from jdk10 to jdk11 : SSLConnection : CKR_KEY_TYPE_INCONSISTENT
microservices,Kubernetes client Job create
iot,Stream analytics quory for IOT
microservices,my postgres database crashes after certain manipulation of an audited table raw
iot,How to architecture an alarm engine?
algorithm,Can heap sort be used to sort a list in descending order?
iot,getting realtime data from ubidots to android app
algorithm,Is Data-Structure and Algorithm same for all programming languages?
operating-system,"Using C#, how to get whether my machine is 64bit or 32bit?"
web,case to include business logic within a website
operating-system,Waking up pthread_cond_timedwait() before time expires
algorithm,Is A* really better than Dijkstra in real-world path finding?
algorithm,Can heap sort be used to sort a list in descending order?
operating-system,"What is the relationship between file-max, ulimit value and open file descriptors?"
machine-learning,I am trying to use gradio for visiualizing my model but am not able to get the labels and its not getting the right match of the model
security,SMB authentication via domain accounts from non-domain machine
security,Windows Security Descriptor Inquiry
security,no IIS installed but Rapid-7 detected X.509 in scanning report
operating-system,What is an address/range of addresses that are guaranteed to be not used in x86-64?
microservices,Dockerized Eureka server can&#39;t get its configurations from a config-data service that is also dockerized
machine-learning,How do I use only parts of a pretrained network in tensorflow with custom input layer?
algorithm,What would be the more efficient to find interesection in time
operating-system,Cannot run assembly on QEMU
web,NEED HELP WP-MEMBER
algorithm,JavaScript - Improving algorithm for finding square roots of perfect squares without Math.sqrt
security,Storing Discord API access tokens in the database?
operating-system,Why does the function .isdir() from the os module work properly on cwd but not on joined directories?
algorithm,"To find a number is prime, Why checking till n/2 is better. What is the reason for avoiding numbres in second half of n"
operating-system,Create child processes to print lines from a file but last line disappeared without extra \n
operating-system,Access denied when try to remove file
database,How to add new column before first column in mysql?
operating-system,How accurate is `st_mtime_ns`?
algorithm,Multiply an element in a Nested Array by certain value and then add the results together
machine-learning,"Overfitting Gradient Boosting, should I increase or decrease learning rate?"
iot,How to enable/disable bluetooth in android java?
web,Why doesn&#39;t my margin-left work properly?
web,Loop through webpages via BeautifulSoup and download all images
microservices,AWS XRay wrong service map when using OpenFeign with AppMesh and AWS Service Discovery
web,Automate a web user task
iot,Not receiving location on phone from SIM 900 A connected with NEO 6M gps and arduino UNO
machine-learning,Incorrect Number of Dimensions on Train and Test Dataset
iot,How to subscribe to the response that returns from http request in Flutter?
web,Selenium Cant Access Page Error 1020 On VFS Global
algorithm,Is Arrays.stream(array_name).sum() slower than iterative approach?
machine-learning,"&quot;Received a label value of 9 which is outside the valid range of [0, 6)&quot; error in model.fit in keras"
operating-system,CentOS on CentOS in VmWare
algorithm,Data structure to find the nearest untaken element
machine-learning,How to use cosine similarity within triplet loss
algorithm,How to apply Bubble Sort to the data stored in different Arrays
operating-system,"Can I execute assembly code on Windows, which is generated using C++ source file on Linux"
machine-learning,Multidimensional Loss Function
algorithm,What is the space complexity of a recursive fibonacci algorithm?
algorithm,Calculating Time Complexity of an Algorithm
iot,Can&#39;t publish data from CC3100 + MSP430F5529 on PUBNUB
machine-learning,control over Vertex AI annotation
machine-learning,Datawig library imputes some of the columns while leaving some unimputed
web,Using pdfMake library i want to give my pdf a size of 6 x 4 cm
algorithm,Support Resistance Algorithm - Technical analysis
web,Intellij Servlet example not working with Tomcat
database,How can I print the first three characters of a column in descending order?
algorithm,Detecting endianness programmatically in a C++ program
database,Simplifying SQL query
machine-learning,"ValueError: NaN, inf or invalid value detected in weights, estimation infeasible.in GLM Statsmodels"
algorithm,I am looking for a radio advertising scheduling algorithm / example / experience
machine-learning,R: How to generate the following data
algorithm,Minimum Cost to reduce the size of array to 1
algorithm,How to properly understand Space Complexity of an Algorithm?
microservices,Ocelot gateway doesnt want to apply microservice route
iot,How to get back a name of a hidden network i forgot
iot,How can I build with ant as a normal user (no need for sudo) COOJA
database,AWS DynamoDB and Storing User Data with Transactional Data in one table
machine-learning,How to display model summary when using keras model with class method for Bert?
operating-system,How does os.system() share resources if I call python?
machine-learning,"Tensorflow - Received a label value of 99 which is outside the valid range of [0, 10)"
microservices,Is it possible to have an API working with both REST and gRPC?
security,problem about predecessor attack in ToR network
machine-learning,what probability corresponds to the class?
machine-learning,Any ways to lower ResNet152 .onnx model file size?
iot,Volume Detection and Recording Option coming from a Smoke Detector&#39;s Loud Electric Horn
microservices,How to start single Spring Boot Microservice on Multiple Ports in STS/eclipse?
operating-system,Set OS(windows) Date and Time through Javascript node
web,Reduce page load time on simple .html file
machine-learning,Why is the accuracy of my model different on my confusion matrix than when I am training it?
algorithm,Generating 10 million 7-digit numbers in Python
machine-learning,How to resolve &quot;AttributeError: &#39;numpy.float64&#39; object has no attribute &#39;predict&#39;&quot; in Machine Learning model?
database,"Error 1046 No database selected while creating a table , using python and mysql database"
operating-system,Is there any module that C++ supports the same as OS module in Python?
security,MS SQL Server Data Anonymise
database,A large amount of data in many text files - how to process and merge them all?
operating-system,"The $Path from Sys.getenv() is different from what I get from CMD, and cannot be changed"
machine-learning,"Keras extremely high loss, not decreasing with each epoch"
machine-learning,What makes a &#39;good&#39; ML dataset
web,Angular text select block by default how to fix
web,JPQL Query not get field element collection
web,Flutter web Stripe failling to display paymentSheet &quot;Error: WebUnsupportedError: initPaymentSheet is not supported for Web&quot;
algorithm,Find all collinear points in a given set
microservices,why is the terminal command not executing from java but is being executed when i directly copy it into the terminal?
security,"How to send HTML form data by email to an email ID by using JavaScript, without using server-side language, without using email client securely?"
web,OpenID Connect provider handle two different sessions bases on parameter
security,C# Checking HMAC SHA256 from API
web,Scrapy - Limit number of pages scraped (CLOSESPIDER_ITEMCOUNT not working)
security,"How can I delete all scripts and triggers, and remove unauthorised access from my account?"
web,FATAL: password authentication failed for user &quot;root&quot; in TablePlus
database,PLSQL - How to handle HTTP request on PLSQL htp generated pages?
microservices,Availability and Atomic update in CQRS
database,Schema in Mongoose and Gridfs
web,why is my &lt;a&gt; tag activating as soon as i open my html file?
database,Easier way of Doing SQL Data Export - Azure
algorithm,Mergesorting in solidity programming language
web,Eventlistener throws error when parsing function
operating-system,What is technically happening in the OS when a device is lagging and inputs from peripherals are deferred?
algorithm,Difference and advantages between dijkstra &amp; A star
iot,IPv6 Telegram setWebhook got &quot;Reserved&quot; message
web,Open in a New tab for all links of a website
database,Can&#39;t define receiver from another package in Go
microservices,Generic Entity for print logs
web,How to use my own local web browser when python scraping?
web,Script that generates config file for website depends on CDK resource
machine-learning,How to use StandardScaler inside a pipeline only on certain values?
security,Error in the converting of private key and certificate to x509 Certificate
database,"I wanna update 2 tables in one transaction, which isolation level needed?"
machine-learning,How can I solve &quot;NameError: name &#39;ArffDecoder&#39; is not defined&quot;?
iot,How can we stop a client connection from mosquito broker?
algorithm,Shell sort running time on pre-sorted list (best case)
iot,Is there any software IoT protocol gateway available which converts BACnet and Modbus to Mqtt?
machine-learning,SHAP Deep Explainer does not work for LSTM: &quot;Attribute Error: &#39;Deep&#39; object has no attribute &#39;masker&#39;&quot;
microservices,Querying data from multiple microservices
database,How data lineage testing to be done?
iot,Amazon echo dot device log to system
machine-learning,How to find optimal K value using Dunn Index?
web,Why does directorys have a http status code of 301?
algorithm,search for suitable algorithms for the space minimization problem
machine-learning,plt.imshow displays dark color
algorithm,Recursion infiinite loop in JS
security,Getting error &quot;403 - Forbidden: Access is denied&quot; on browser when user is NOT administrator
algorithm,Analyzing efficiency of non-recursive algorithm
database,How to convert a big MySQL Database from utf8 to utf8mb4?
microservices,How to implement saga pattern with nestjs?
machine-learning,Neural Network vs Linear regression
algorithm,How to find all words that &quot;contain&quot; or &quot;unscramble&quot; an input string using a Trie?
iot,What protocols are used to control IoT devices remotely over the internet other than MQTT?
operating-system,Is a coroutine a kind of thread that is managed by the user-program itself (rather than managed by the kernel)?
algorithm,How to prove the correctness of this solution for Codeforces problem &quot;A. Boredom&quot;?
algorithm,javascript backtracking algorithm with strange bahavior
operating-system,Can PWA listen in on OS events?
microservices,How to dynamically get a database connection in spring boot app with 2 databases?
web,"When running a .ejs file I keep getting an error, is the error in my code or is it somewhere else in the program? how can I fix this?"
machine-learning,Does the value counts of 1&#39;s and 0&#39;s in my dataframe while using a Decision Tree Classifier matters?
machine-learning,How to obtain specificity and negative predictive value from Scikit-learn for multiclass classification?
database,"Is it better to use multiple databases with one schema each, or one database with multiple schemas?"
microservices,Duplicate column issue in migration scripts in .net microservice module. I have to resolve duplicate column in my migration which already executed
microservices,How to change @JsonApiRelation lookup property value in run time in java
web,flexbox- I cant figure out what&#39;s causing this div to have a blocked out space in flexbox
security,CrowdStrike API - How to pull all active hosts&#39; without specifying Host Id&#39;s?
iot,IIOT OPCUA Alarms and Events node-red
iot,Can you save a online library in the spiffs so you can access it offline
database,how to drop partition without dropping data in MySQL?
microservices,Can&#39;t delete containers
database,why my nodejs application is not connecting with xampp database which is on server and why my server is refusing database connection
web,My form is shifting to a backend page in php after clicking on Submit
iot,Arudino multiple leds on after one another
web,How can I decode the extensions of a x509 certificate?
iot,Send MQTT messages from AWS Lambda to my IOT Device
microservices,Can&#39;t reach NodeJS microservice through Spring Cloud Gateway + Eureka
algorithm,Best Approach to implement Stop Loss / Take Profit in Python
iot,TCP buffer issue when publishing data from ESP32 on to mqtt broker
machine-learning,How to reduce the size of Bert model(checkpoint/model_state.bin) using pytorch
machine-learning,Why is my model having so much ram consumption and taking so long?
operating-system,Why os.path.realpath doesn&#39;t work properly
security,Not able to Apply Quotas at App Engine Instances
iot,"Visual Studio application exited with code -1 (0xffffffff), application is not responding connect Azure IoT Central"
database,Entity Relationship diagram interpretations of a inventory database
machine-learning,Add extra file to azureml InferenceConfig
web,Youtube API connection with website don&#39;t work
iot,Send Azure Iot data to azure gen2
database,how to save radio buttons value in mysql from laravel
web,Mailer Error: SMTP Error: data not accepted. SMTP server error: DATA END Error: Error: Not enough credit. SMTP code: 421
database,How to group rows with same values in sql and don&#39;t disturb after applying order by?
web,VS Code Command won&#39;t open web browser
machine-learning,Is my Implementation of K-means with Manually Set Centroids Correct?
operating-system,"What exactly are hard links and symbolic links, and what are the differences between them?"
iot,"How to make a streaming server, that can stream audio to multiple mobile phones over WiFi?"
iot,Is HTTPS secure if I always send the same message?
operating-system,Is there a way to trick iOS into thinking it is a different device?
algorithm,Derivation of path wise feature attribution in Tree SHAP
machine-learning,Logistic Regression with Gradient Descent
database,Sql how to count the number of occurrences of the same rows in the database
database,Operations with aggregate functions - SQL Server
microservices,Getting this error in node.js Error: getaddrinfo EAI_AGAIN
database,Unable to establish correct parent-child relationship in sql
microservices,Presenting Serverless Microservices
operating-system,What is the difference between the kernel space and the user space?
web,A function that is defined inside the methods{} is showing an error when it is called outside
operating-system,How do operating systems handle different character encoding?
operating-system,System call: does Read function change process?
iot,Output data from Influxdb to MQTT broker/server
iot,No telemetry trigger in TB
database,Oracle Database - JavaVM invalid
algorithm,Check if Array is sorted in Log(N)
machine-learning,Microservice to perfom image evalution of cars
security,Do Python or Pycharm have a log of past console output?
operating-system,Find the most expensive operation in terms of disk block transfer in UNIX
algorithm,Check for Valid Parentheses in java
security,"mtls client, curl sending request works, nginx forwards 400 &quot;Bad Request&quot;"
web,How can i put Dictionary to the model (Java MVC)?
microservices,How to implement BackOffice on Microservices Architecture?
algorithm,Coding the Variable Elimination Algorithm for action selection in multi agent MDPs
microservices,"TLS/SSL between microservices, api-gateway and a config-server in Spring Boot?"
algorithm,Is this assignment problem with constrains NP-hard?
algorithm,Integer based rounding issue
operating-system,Producer Consumer Never terminating
web,How do I make it so my page can close or reload but the content wont disappear when i open the page again?
algorithm,"Why increase pointer by two while finding loop in linked list, why not 3,4,5?"
web,How to add item to arrayList and display it in another file in JSP
database,What database would you use for delivering webhooks?
database,MySQL GROUP by Regex?
security,How To Add X-XSS-Protection and X-Frame-Option to Response Header in PHP using .htaccess
machine-learning,GPU question about multithreading and machine learning
machine-learning,LGBM not varying predictions with random state
web,Excel Power Query &quot;External table is not in the expected format.&quot;
algorithm,Why doesn&#39;t minimax pick the best position in Tic Tac Toe?
algorithm,How multiple recursion works?
operating-system,Issues with spacy model en_core_web_lg : how to prevent the package from downloading every time the code is run
microservices,Best practice for microservice message contracts
operating-system,Dose child process become zombine process when it&#39;s not handled by parent process using WaitForSingleObject in Windows?
database,Database sum() values together if string matches in VBA
iot,WebSocket API implementation with EC2 as a backend
web,Nginx and Certbot fails when trying to get certificates
web,What is the best way to make API server ? flask or HTTPServer
microservices,What is mSaaS in context of Quickbooks cloud engineering?
database,Where is the problem in my corde(YML file) or Azure database? Spring Boot and Azure
database,I&#39;m having a problem if the player dies but has clones of the same tool instead of all the clones saving only 1 does how can I fix this?
web,What does &quot;URL-safe&quot; mean?
iot,SIMCOM A7600E trouble receiving UDP packages
microservices,Cannot determine the frame size or a corrupted frame was received
iot,"I can not connect my Mbed Simulator to my TTN end device, I am using docker"
database,Approach to storing forecast time series data using python
database,Looking for detailed explanation of Hibernate UserType methods for mutable objects
iot,Download openCV on windows to install on Raspberry PI
operating-system,What is OS Task and Period for each event in Operating system?
operating-system,"if user input is not a directory, how can I make the directory a default value"
database,Date format :DB2
web,flashplayer is required and I can&#39;t get it
algorithm,How to prevent a recursive method from changing a value of a variable?
database,FastAPI database SQL
machine-learning,How to fill missing values in a Pandas DataFrame using other columns
web,Is it possible to add a NFC serial number to URL to register an User?
algorithm,Merging list elements using Python - This algorithm presents a huge challenge for Python developers
operating-system,Python3. How to save downloaded webpages to a specified dir?
iot,IoT Early Flood Detection with the ability to connect to IoT azure HUB
iot,Difference between Fog and Edge computing
algorithm,Is there an algorithm to sort points in the plane in different orientations in linear time (with nonlinear preprocessing)?
microservices,Spring boot application throws OutofMemory Exception when downloading large file(more than 100 mb) even though allocated memory is 1 gb
security,"Using the standard developer exception page, can I configure what is included?"
operating-system,Permissions keep resetting on windows
web,Deploy Office Web add-ins in the Microsoft 365 admin center
