Tags,Title
security,Fabric: InvokeChaincode with chaincode identity
microservices,Dynamicallly retrieve Spring Boot CORS Configuration from database for specific method in a Controller
security,Not able to Apply Quotas at App Engine Instances
machine-learning,from_formula() missing 2 required positional arguments: &#39;formula&#39; and &#39;data&#39;
machine-learning,It it possible to have data leakage from the training set to the test set in a Machine Learning data preprocessing?
machine-learning,How to deal with NotImplementedError in training Unet model?
web,Looping until max results
web,AWS S3 Static Hosting with IAM User Only
operating-system,What kind of file needs to contain the _start() function
iot,How to represent C2D message in IoT Plug &amp; Play DTDL definition
microservices,How to dynamically get a database connection in spring boot app with 2 databases?
security,strategies to create centralized storage for SSL/TLS certificates on AWS
machine-learning,ValueError: could not convert string to float: &#39;long&#39;
algorithm,"Solve a Shikaku (rectangles) puzzle game ,with possible solutions"
machine-learning,Tensorboard Callback
algorithm,Drawing cards in order with conditions
database,Where can I find the CryptDB implementation based on PostgreSQL?
algorithm,Why can the &quot;Wave Function Collapse&quot; algorithm fail?
algorithm,Algorithm to generate all possible permutations of a list?
web,AngularJS Calendar&#39;s years dropdown disappears in tablet but not in pc
algorithm,Print all powersets of an array giving wrong answer
web,Focus only elements on Tab keypress with &quot;tabindex&quot; property defined
security,Pass SSL certification verification for HTTPS in loopback
database,Connection failed: SQLState: &#39;01000&#39; SQL Server Error: 53
web,What does &quot;URL-safe&quot; mean?
operating-system,Isn&#39;t &#39;nice&#39; in linux too dangerous?
web,How Manage SEO In flutter web?
algorithm,How to find a path from one point to another among many connected points?
algorithm,Modify array to have distinct elements and equal number of odd and even elements
database,Why use an auto-incrementing primary key when other unique fields exist?
machine-learning,How to make an accuracy comparison for time series prediction using LSTM and RNN model?
security,how to secure JWT both client and server
machine-learning,ValueError: After Fitting Model
security,Can a web application bind arbitrary ports on the localhost on the user&#39;s machine?
operating-system,What happens to TCP connection on socket timeout
operating-system,Why does the code evaluate to false when str is set to &quot;value&quot;?
machine-learning,Detectron2 - Same Code&amp;Data // Different platforms // highly divergent results
database,Inserting values from java netbeans into specific row and column of sqlite database
security,How to create a filtered data table with columns without using pandas
microservices,Which is the best way for the routs uri in spring boot except zuul and spring cloud gateway
operating-system,Operating System - Simple Login System
algorithm,How much is the flow in an edge in the opposite direction?
operating-system,Read py file from one location and point pdf writer to another
iot,Is there any way to check if my Stream Analytics input is already in a table?
machine-learning,What do I do next after FLAML provides the best model?
algorithm,Fastest way to find 4-connected regions
algorithm,What runtime algorithm does Stockfish (chess engine) use?
web,java.lang.UnsatisfiedLinkError: no rxtxSerial in java.library.path:
machine-learning,Uncertainty in target feature in machine learning
machine-learning,Which model performance metric is used for SVR model by sklearn?
security,How do you do &quot;remember me&quot; functionality in AngularJS?
microservices,why is the terminal command not executing from java but is being executed when i directly copy it into the terminal?
security,Execute host commands from within a docker container
database,Error loading physionet ECG database on MATLAB
microservices,How to Change value of placeholder in yaml file from Controller Class
microservices,Exception encountered during context initialization
database,How can I retrieve a blob from SQL server and show it as an image in Apache Netbeans?
machine-learning,How to handle dataset which is a csv file that contains image names in one column and image path in other column?
operating-system,Expose zipped shapefile from multiple zip file in folder and save to dataframe
operating-system,How to check which shell I&#39;m using?
microservices,Elastic Stack (ELK) for multiple projects
machine-learning,LSTM and self-attention ordering
microservices,NextJs error deploying on ingress nignx: Uncaught SyntaxError: Unexpected token &#39;&lt;&#39;
database,Shopify external database connection
database,Is possible to have a Composite Primary Key which components are entity foreign keys?
security,How to block the executable file upload in web server
web,Material UI Select menu displays horizontally instead of vertically
security,How to integrate ML model in web app/android app?
security,How to remove https://optimizationguide-pa.googleapis.com call execution when the developed application runs?
web,Why do I get &quot;pointermove&quot; events with undefined movementX/Y on iOS?
machine-learning,sklearn DecisionTreeClassifier loop for max_depth
database,CnosDB compare with other Database
machine-learning,how to convert .pth.tar file to a .pt?
web,How can I get data from another Vue file?
web,Database Table creation for login to store multiple category of users
web,How to use the ssel settings of a service using the build.xml of the proyect
machine-learning,Deducing the number of human beings performing an action using NLP
iot,Connection between Node-Red running in IBM Cloud and sqlite in localsystem
operating-system,How fork() changes local and global variables
web,Error: com.microsoft.sqlserver.jdbc.SQLServerException: The index 2 is out of range
operating-system,Number of entries require in the FAT table
machine-learning,new features in dataset
machine-learning,TypeError: encode() missing 1 required positional argument: &#39;encoding&#39;
machine-learning,Google Colab ImportError: cannot import name &#39;functional_datapipe&#39; from &#39;torch.utils.data&#39;
database,"This document does not exist and will not appear in queries or snapshots, but identically structured document works"
security,Dynamic SECRET_KEY in Django disadvantages
iot,Connecting an ESP8266 to AWS IoT Core - getting &quot;WiFiClientSecure SSL error: Unknown error code.&quot;
operating-system,Printing to 0xb8000 not working correctly - osdev
algorithm,What is wrong with the dynamic Programming state
microservices,Querying / Pagination Across Microservices
microservices,spring cloud secured gateway ratelimiting not allowing permitall urls
microservices,How to use single Kafka Client to all services?
algorithm,How can I improve its runtime
web,Django-axes Errors: &#39;Settings&#39; object has no attribute . .
database,Distributed graph DB: Performance measure
iot,TDengine Want to Use Multiple Path for Storing Data
algorithm,Maximal sidelength of a square containing a point and intersecting no other square
web,How handle long press event in react web
microservices,Kubernetes microservices monitoring &amp; alerting
algorithm,How to implement FABRIK algorithm (inverse kinematics) with joint angle constraints on Unity?
microservices,Spring Boot and React: Access to XMLHttpRequest at X has been blocked by CORS
web,How do I choose the Host to deploy a web app project with netbeans and tomcat?
iot,Can not find Device Id in Azure IoTHub events
web,Loop through webpages via BeautifulSoup and download all images
machine-learning,Running a simple onnx model on Jetson Xavier DLA
database,How we create datagridview through vb.net
operating-system,Plotting multiple graphs from multiple text files in python
security,Laravel webpage with security protocol https
iot,ThingWorx Subscription code isn&#39;t getting executed on reaching an alert threshold limit
web,Why does the website is getting lost after visiting to any link and refreshing
machine-learning,How do you use Keras LeakyReLU in Python?
iot,Google IOT: Identify the device is back online after sendCommandtoDevice failure
database,Oracle XE configuring for benchmark
iot,How to Log IoT Data in specific time interval using Flask/python
iot,Firebase Realtime Database Security Design
microservices,API Gateway Pattern + OAuth
iot,How to do Software deployment for IoT devices (Linux based)?
algorithm,Student-group allocation algorithm
database,PHP Radio Button not sending value to MySQL database
database,I have questions about Shopify and the Dotnet (ASP.NET Framework)
operating-system,Electron: Disable PC hibernation/sleep/suspend programmatically
security,How to hide API Keys in AndroidManifest.xml
microservices,NestJS gRPC Cant connect to microservice
microservices,Automated API testing project - Where to deploy framework - CI/CD Pipeline
iot,Queued messages are getting lost when I restart a broker in verneMQ cluster
web,Automating 6 Keypresses (DreamWeaver Save Upload Page Refresh and Back) into 1 Keypress with AutoHotKey
machine-learning,How to perform a Linear Regression by group in PySpark?
security,Alerts from non-enabled rules on pfsense Suricata
algorithm,Implementing Bubble Sort in the custom LinkedList. Sorting more than 4 elements triggers a NullPointerException
database,How to create a table of wildcards
iot,AWS IoT Device Onboarding
machine-learning,Which confusion matrix is correct?
database,What is SQL&#39;s Keyword order? (Postgresql)
operating-system,gcc asm: redefined symbol cannot be used on reloc
iot,Flutter php auto send data
operating-system,how to rename files in a folder using pathlib in python?
machine-learning,Shape of weights in hidden layer(Multilayer Perceptron)
machine-learning,How to print this code accuracy in neural network python
database,how to avoid the null value in database relation column
iot,How do you publish telemetry from Azure IoT Hub to a MQTT topic?
database,Data is not being inserted into HSQLDB database using Hibernate
algorithm,algorithm to split planning path from n gps points
iot,How to track mobile devices around beacon
database,Android database encryption
iot,check if any light is turned on in raspberry pi led Python
web,Getting Weird &quot;OKHTTP&quot; get request on my Website
operating-system,Can we write and read files on the disk using NW.JS in Construct 2?
machine-learning,Domain Adaptation and Transfer Learning Algorithms for Text Classification in Python or R
operating-system,Unable to extract some files from zip file
machine-learning,How to deal with a skewed Time series data
algorithm,How to find all words that &quot;contain&quot; or &quot;unscramble&quot; an input string using a Trie?
machine-learning,"Understanding why in self-attention, number of features should be divisible by the number of heads"
security,Access token and Refresh token best practices ? How to implement Access &amp; Refresh Tokens
web,Django 4 problem: user can&#39;t login but admin yes
web,Initialize a State with Props in Reactjs
iot,connect from web to iot core using a custom authorizer
algorithm,Doomsday fuel google foobar test 4 and 5 fails
machine-learning,Why is a regression tree considered regression?
machine-learning,Cosine similarity for large sparse matrix
web,I can&#39;t see my 404 and 500 custom pages in Django
microservices,How to handle unsent data in microservices
operating-system,gcc asm: redefined symbol cannot be used on reloc
database,How to create autoincrement integer field in TypeORM migration?
security,ASP.NET Identity&#39;s default Password Hasher - How does it work and is it secure?
machine-learning,Cannot import name &#39;dtensor&#39; from &#39;tensorflow.compat.v2.experimental&#39;
web,How do I display html files with rocket.rs
iot,Smart IOT log data Filtering
operating-system,About Ram &amp; Secondary Storage
operating-system,Does a Linux process belong to a session?
database,Scraping a dynamic table in an iframe
machine-learning,Node js Converting text/pfd/word/jpg to Speech with Amazon Polly
web,VueJs - Vuex - Change a state
security,Keycloak Event Listener invoke Spring Boot Endpoint
security,Remove IIS server details in Angular application
algorithm,Need some assistance with PowerShell implementation of K-Means Clustering algorithm for sport leagues
web,Typekit Css gets Blocked
operating-system,How are logical and physical address same in load time address binding?
security,In which format these data are encoded? Is there any way to decode these data?
microservices,Is it a correct approach to have multiple API Gateways integrated with same NLB?
operating-system,When should the option RemainAfterExit needs to be set true when creating new systemd services?
iot,What protocol is used when user is interacting with node-red dashboard
database,Symfony 5 doctrine flush slows down
security,How to PHP code injection to remove previous characters?
machine-learning,Are there any models to extract specific data from pdf files?
machine-learning,"Python, Detect Device Type using List of Words?"
operating-system,Infinite loop in critical section solutions
iot,Meet exception when compiling IoTDB
iot,How can I increase the transmission speed between XBees
iot,AWS IoT Device Management from external web app?
operating-system,Python Jupyter notebook ossystem / nbconvert path change
web,Change the error message on the shiny website
database,Bigquery job failed with error: Encountered &quot; &quot;FROM&quot; &quot;FROM &quot;&quot;
machine-learning,Pad torch tensors of different sizes to be equal
web,Status code is Unauthorized for response which takes more than 5 min
algorithm,How to Judge the Equality of 2 Triangular Meshes?
microservices,Spring cloud gateway returns empty response
microservices,read with java a log file outside of the deployed jar folder
algorithm,Leetcode Q. 1528. Shuffle String
machine-learning,Need to increase the accuracy of my LSTM model
algorithm,SHA-256 written in JavaScript ends in infinite loop
security,IntelliJ Package Checker not finding vulnerabilities
machine-learning,RuntimeError: Trying to backward through the graph a second time (or directly access saved tensors after they have already been freed) AMP
machine-learning,MacBook Pro slower than Colab
web,How to fix: Abort called in C++ Hackerank?
web,Get list of all comments made by a given user with Youtube Data API?
web,How I can store ACCESS_TOKEN from site that use OAuth?
microservices,java finished with non-zero exit value 1
iot,Convert standard Array into columns in Snowflake
web,Google places not returning specific adresses
security,How to fix CVE-2019-8457 vulnerability in Spring Boot
microservices,Nestjs as API gateway + Moleculer as microservice
algorithm,Reverse sigmoid function in python
microservices,Config data location &#39;configserver:http://localhost:8888/&#39; does not exist
database,when i try to run this code in dbeaver it give me this error &quot; [SQLITE_ERROR] SQL error or missing database (near &quot;fk_GRADES_ID&quot;: syntax error)&quot;
operating-system,Overwriting an existing txt file with new data using Python OS module
iot,AWS IoT Sitewise Data Access Externally
database,peewee Python connection to mysql
microservices,"This application has no explicit mapping for /error, while calling from one service to another using feign"
database,How to search on title and use another column to check for uniqueness
database,How to check keyspace and table size in Amazon Keyspaces
security,Are HTTPS headers encrypted?
machine-learning,Survival probability for individual passenger for Titanic Dataset
operating-system,Why can&#39;t I install python packages with pip on windows 10?
database,FastApi Sqlalchemy how to manage transaction (session and multiple commits)
web,How to clean old vue/node local server data?
database,Is my entity relationship diagram correct?
algorithm,maximum sum submatrix in higher dimensions
security,How do I make an IOS app *require* DNSSec?
algorithm,"Given a color, how can I organize a color palette to quickly find the most similar color inside of it?"
machine-learning,Running Random Forest in Parallel
machine-learning,Is the loss printed by tensorflow a batch/sample wise loss or is it a running average loss?
microservices,General guidelines to self-organized task allocation within a Microservice
operating-system,Access denied when try to remove file
database,Cannot create entity where two of the properties are another entity&#39;s Id and ArrayList of Ids of another entity
security,Keycloak JWT Validation using Java Spring Security + KC Adapter
machine-learning,Compute the loss of a moving dataset
database,How do I create a new user in postgres then immediately take the user ID and use it to create a new object?
machine-learning,Convert onnx model to keras
database,How Do I compare two tables and insert the difference from one into the other?
security,A question about pgcrypto document in PostgreSQL
machine-learning,ImportError: cannot import name &#39;DecisionBoundaryDisplay&#39; from &#39;sklearn.inspection&#39;
security,How to create .pfx file from certificate and private key?
security,Computer/Network/IoT Security dataset with challenges
algorithm,Convert list of triangles and rectangle facets into a solid polygon?
iot,"How to connect, control, preview the camera of another android device from my android device?"
operating-system,How to reliably detect os/platform in Go
web,API Web HTTP Request from DLE Vision Flow (Austria)
algorithm,Double Increasing Series relation explanation
operating-system,How to create a Bootable GTK Application?
iot,Embedded - SIM7600E not responding to any AT commands
database,What would be the best language to use to take data from an excel or google sheet and fill an existing pdf with a row of data?
web,LARAVEL 9. ERROR LARAVEL EMAIL: Unable to connect with STARTTLS: stream_socket_enable_crypto(): SSL operation failed with code 1
database,Configure multiple postgresql database according to environment variables in Node JS
database,Why MapDB is slower than LMDB and RocksDB?
iot,Read the Data from the Kura
microservices,upgrading solution with many projects asp.net from 4.6 to 6.0
iot,Remote Web GUI for C++ application
operating-system,What is page table No (0 or 1 or 2) in 2-level paging?
algorithm,C++ unordered_map implementation problem previous values in map get forgotten
operating-system,Modify clock interrupt handler xinu
operating-system,Program Signals Execution Flow in C
operating-system,Calculate the number of entries in a Page Table
iot,Recovery of IoT devices containing a single expired CA certificate
iot,How to emulate IoT devices and identify them using active scanning methods?
security,Obfuscating password in batch script
web,Url path not changing when navigating back to previous page in flutter web
iot,aws iot subscribe with php sdk?
security,How to prevent accessing a view from a user in oracle
operating-system,why 32bit of memory requires only 1 bit of the map
iot,LoRa based network stack alternatives to LoRaWAN
algorithm,Code Optimize : Shifting a List of Integers in Java
database,"In Kettle, how to acquire table output step&#39;s db connection when this step is called? Instead of get all db connection at first"
microservices,Best approach for communicating between Emailing microservice and others
operating-system,Running script at startup with python
operating-system,listen EACCES: permission denied in windows
security,no IIS installed but Rapid-7 detected X.509 in scanning report
algorithm,"Algorithm: Given an array, find the maximum sum after rearrangement"
iot,Decoding IoT protobuf message from gcp PUB/SUB
web,"Unable to get location or chose location in flutter web enabled application,where as it is working on mobile phone"
algorithm,PermCheck codility. O(N) time complexity
machine-learning,Reservoir computer predicing the inputs
operating-system,Understanding how keyboard input interfaces with the OS and user processes
security,Preventing arbitrary filesystem reads when serving files from directory
operating-system,Problem with sending dynamic array in write system call in c++
web,"How can I show information such as number of users, group logo using telegram api on the website?"
iot,How to convert date time in hex in android
web,why I can&#39;t download pdf using flutter web
machine-learning,How to freeze weights in certain layer with Keras?
web,Please how do I solve error Uncaught TypeError: Cannot set properties of null (setting &#39;style&#39;)
operating-system,When should the option RemainAfterExit needs to be set true when creating new systemd services?
iot,What are the parameters that can define a radio type?
machine-learning,Manually Add New Words &amp; Assign Scores
database,What is difference between transient state and removed state in JPA?
database,What is the SQL query for returning Ids that contain only one certain value and nothing else?
microservices,What are the option to API gateway with docker?
machine-learning,Implementation of Binary Neural Networks for Fixed pattern Noise reduction
web,Parsing data from Flightradar24
machine-learning,Content-based recommendation system: TF-IDF putting to much weight on names
machine-learning,why is my loss function only returning NaN values?
machine-learning,How to properly load StandardScaler to Tensorflow Keras model?
security,CodeQL: Deserialization of untrusted data
database,Ecto - posgtres modify string column to string array column
algorithm,How to only pull last 24 hours logs from Slack accesslogs API?
security,Do I need to set AWS VPC RouteTable IP Ranges to a blackhole if I want to drop the packets
security,Open device password change programmatically android
web,How to add JS module to wordpress theme
web,The aria-expanded shows false even when the element is expanded
machine-learning,Solving captchas with template matching in OpenCV?
operating-system,how can I make directory?
microservices,Ocelot always unauthorized with AuthenticationProviderKey
microservices,Spring cloud gateway returns empty response
operating-system,What kinds of things are stored in 1 byte files?
database,(mysql.W002) MariaDB Strict Mode is not set for database connection &#39;default&#39;
security,debsecan CERTIFICATE_VERIFY_FAILED failure
algorithm,Theoretical - Fastest way to compute different counts
machine-learning,Agriculture commodity price predictions using machine learning
web,Dynamic web project missing in STS
algorithm,Recreate an object from an array of objects in Javascript
security,MS SQL Server Data Anonymise
machine-learning,"fitting the model model.fit(X_train,y_train,validation_data=(X_test,y_test),epochs=2,batch_size=32)"
operating-system,Is there a way to get an operating system to report the mouse location to a USB device
algorithm,Fastest way to &quot;sort&quot; bit sequence by toggling bits
machine-learning,How shall I add one of the key and its values of second list of dictionary to the first list of dictionary based on the condition
machine-learning,Removing background and its noise to accentuate X-ray image of focus?
microservices,404 trying to route the Upstream path to downstream path in Ocelot
algorithm,Find k-th minimum sum of every possible subset
security,How can I safely add game items to a user in a blockchain game?
algorithm,R custom predict algorithm implementation problem
microservices,What projects architecture should I use?
machine-learning,Is there a way to vectorize and add new values to a pre-stored tfidfvectorized vector
security,API End Point Which works on Basic Auth
algorithm,I am making a web application and I want to write an algorithm. I am using MERN as technology stack
microservices,How to check if a user re-logged in and accessing the same API in ASP.NET Core Web API
iot,How to use custom Google Assistant commands without &quot;Let&#39;s talk to&quot; and without IFTTT
web,Seeking insight on function that randomly moves picture across webpage
algorithm,Check std::vector has duplicates
machine-learning,Machine Learning outcome with more than 2 categories-caret
web,Exporting a specific rows from database to .XSLX file
operating-system,How to suppress TASKILL output in python os module
iot,DecodeError when reading Proto Buffer message from nanopb
database,How to link a checkbox and a button in a specific record in MS Access
algorithm,How to deal with an 64 digit input for a Karatsuba algorithm implementation in java
operating-system,What is a Kernel thread?
algorithm,How do I check two Typescript object arrays for equivalence when some objects have multiple equivalencies?
machine-learning,Unable to train ML model using sklearn
security,how to prevent docker from mounting certain locations as volumes?
algorithm,Finding the minimal value in any range of an arbitrary array in log time complexity
operating-system,Context.startForegroundService() did not then call Service.startForeground()
microservices,Unable to connect to MongoDB: MongoNetworkError &amp; MongoNetworkError connecting to kubernetis MongoDB pod with mongoose
algorithm,Analyzing efficiency of non-recursive algorithm
operating-system,Unable to Launch Child Process with command line arguments C++
algorithm,"Queue theory, program to limit user queue time"
database,The connection to the database will be closed correctly? psycopg2
algorithm,Binary search complexity analysis (Uneven Split)
machine-learning,Can Non-trainable params be ZERO after model compiling in CNN
web,Django UserAdmin&#39;s add_fieldsets?
web,styling css by confdition from the backend
machine-learning,Mutable nearsest neighbors?
security,Is std::regex safe for user-defined expressions?
machine-learning,Adjust threshold in cros_val_score sklearn for Lasso
