Tags,Title
operating-system,Program Signals Execution Flow in C
iot,Can cellular SIM can be the part of LoRA Network or Not?
machine-learning,VNGeneratePersonSegmentationRequest slow on Intel MacBooks
web,Apache FOP - is there a way to embed font programmatically?
operating-system,Sampur is counted as initialized to 1
microservices,How to organize git repos and docker in a multi service system
web,How to resize a Konvajs scene with CSS?
operating-system,Listen to all interrupts with Python
database,Laravel: Running a database migration on a production server
web,Why is background color not changing for navbar on scrolling?
iot,UDP broadcast for IoT discovery using Raspberry PI and public wifi
operating-system,Purpose of bitwise operation in this example
security,How to prevent a browser from storing passwords
algorithm,Round get array slice roundly except on array value with same order
database,Database for Flutter Project?
algorithm,Theoretical - Fastest way to compute different counts
operating-system,arm cortex m4 xPSR change when branching
machine-learning,How to create tensorflow dataset from runtime generated images?
algorithm,How to generate a random N dimensional rotation matrix using Python?
database,How can I do Many to Multiple Many relationship in Room Android?
operating-system,Figma can&#39;t find password dots shortcut
security,What&#39;s alternative of eval function in PHP
database,It is necessary to normalise the table in order?
database,Don&#39;t select rows where column A is duplicated AND any row of column B is a specific value
database,Aggregating averages from large datasets for number of steps over period of time in ArangoDB
iot,MQTT instead of wss on browser
operating-system,"shutil.move() move from directory program is ran from, to target folder"
web,Render template context data referenced from hardcoded HTML in Django model
algorithm,How to handle CR and LF in the proper way in Java (android)
web,GoLang web service - How to translate errors declared in package
algorithm,Why doesn&#39;t minimax pick the best position in Tic Tac Toe?
iot,Python Crontab user parameter throwing error FileNotFoundError: [WinError 2] The system cannot find the file specified
machine-learning,dataset for computer vision tasks
web,Instance of &#39;minified:p&lt;dynamic&gt;&#39;: type &#39;minified:p&lt;dynamic&gt;&#39; is not a subtype of type &#39;List&lt;String&gt;&#39;
iot,"Is there an &#39;open&#39; implementation of ThinQ - ie, independent of registration on LG sites?"
microservices,java.net.UnknownHostException: Failed to resolve &#39;inventory-service&#39; after 4 queries in Spring Boot and Cloud
web,How can we create a text switching animation with angular 13
web,Can&#39;t scrape API with dynamic value in the URL
security,Are there two root keys in Docker Content Trust?
algorithm,Chats list withdraw logic
operating-system,iOS Operating System Process Management
iot,Issues with IoT Simulator (Maven Build)
web,file_get_contents returns 403 forbidden with user agent - PHP
microservices,Exception handling in GRPC - return common object
operating-system,Why doesn&#39;t os.makedirs work when bundling python script with pyinstaller?
machine-learning,"cost = -1/m * (np.dot(Y,np.log(A).T) + np.dot((1-Y),np.log(1 - A).T)) Why is it np.log(A).T"
security,Auth0 and Flutter - API scopes and permission
database,Kotlin Room Database: How to save result from sum query?
machine-learning,Drop redundant data when doing binary classification?
database,elastic how to group by and sum
database,Get Emails Not Replied from Shared mailbox VBA
algorithm,"How to paginate a trie, so you can find 100 words matching prefix in the trie, starting at a paginated offset?"
microservices,How to create chat with API Gateway using sockets [JAVA]
web,How to get audio stream from cordova-plugin-audioinput for realtime visualizer
iot,IBM IOT code for publishing and subscribing Topics
security,PHP setcookie &quot;SameSite=Strict&quot;?
web,Why doesn&#39;t my margin-left work properly?
microservices,RabbitMQ not finding job class in Laravel
algorithm,Rotate image - leetcode
operating-system,Xinu - Setting new priority for a Suspended state process
machine-learning,Compositional data preprocessing for machine learning
operating-system,How does de OS know which solution to apply to a concurrency problem?
web,How to convert a Yii2 local website to a desktop executable?
microservices,Jaeger distritubed tracing with application integrated with 3rd party APIs
database,SQL (bigquery) Repeat values from previous day if they don&#39;t exist already
microservices,Should i open a event listener or rest end point for redirect url for Integrating Digilocker authorize api in my springboot app?
web,how to resolve min/max width error domp while generating pdf?
microservices,.Net core microservice from docker trying to access oracle database
machine-learning,AttributeError: &#39;GridSearchCV&#39; object has no attribute &#39;cv_results_&#39;
algorithm,"Selecting N elements from a list of (item,ID) , in the ratio of weights assigned to their IDs"
iot,How ThingsBoard servers in a cluster communicates with each other?
microservices,FallBack method not working with @GetMapping() in cloud-api-gateway(Spring boot Microservices)
microservices,Issue with configuring and Sending RPC queries using KubeMQ
operating-system,Creating zombie Process in C
algorithm,What is an algorithm to divide a rectangle into N number of square(ish) cells?
security,Accessing GraphDB with RDF4J with an specific user
security,How do I properly protect a password when the source code is available?
web,How to resize a Konvajs scene with CSS?
database,Anylogic: How to export datasets_log to a table after simulation run?
web,how to open a web page in angularjs modal
security,Intel SGX root key
web,&lt;video&gt; tag renders differently in mobile and PC
database,In MySQL data is stored in disk or in main memory and how data is access from database
algorithm,Convert list of triangles and rectangle facets into a solid polygon?
operating-system,No Boot device found
microservices,Microfrontend framework for integrating react apps into an already developed monolith
operating-system,Process starvation test case on XINU
security,F5 Security - How to bypass Shape Security AI
iot,Sim7080G module can&#39;t send data over TCP while using GNSS
web,Mailer Error: SMTP Error: data not accepted. SMTP server error: DATA END Error: Error: Not enough credit. SMTP code: 421
iot,TDengine why does query through RESTFUL consume more CPU compare with query through terminal
iot,Printing using CUPS via Internet
iot,AWS iot with esp8266
algorithm,I have this following algorithms question that I have solved but is not good for different test cases
iot,React Native invoke mDNS endpoints
algorithm,Problems with video recording logic; filling empty frame and synchronizing fps
machine-learning,User program failed with RuntimeError: CUDA out of memory. when I try to run gradcam on set of images
security,Find the owner of an AWS Access Key
iot,Azure IoT Hub Certificate
machine-learning,access onedrive from azure ML notebook script - 400 Client Error Tenant does not have a SPO license
web,Paths of a url what not to put?
web,Interactive display with large set of RGB data
algorithm,Find all connected components and their sizes in a graph
database,Unexpected EOF in Flask
microservices,What is a microservice?
microservices,Questions about using the same DbContext across multiple microservices
microservices,Create gocql mocks for testing using https://github.com/golang/mock
machine-learning,Lime value and feature importance are inconsistent with different random seed
algorithm,Java - Sort one array based on values of another array?
operating-system,run linux command using execlp with more than one argument as string in c
machine-learning,Using text classification model for predictions
iot,Connect an ESP8266 to Power automate/Excel via HTTP request
operating-system,Can&#39;t run my code if my input is a file from another directory
microservices,Kubernetes client Job create
database,DB2 SQL extract only month and year from date column
algorithm,How to quickly pack spheres in 3D?
security,Securing user data on strapi or firebase
algorithm,Why empty list is coming at output?
machine-learning,Keras Model Performance Changes
algorithm,how to parse nested json by javascript
algorithm,PermCheck codility. O(N) time complexity
web,Any Third party Text-to-speech API we can use in React project?
machine-learning,Does an LSTM model use trend in features?
algorithm,"Let G=(V, E) directed graph. Let v be a vertex in G, find the number of vertices that take part in non-simple directed paths to v"
database,How to update SQlite database in android application?
operating-system,Reader-Writer problem but each writer has his own book
machine-learning,PyTorch: Batch size and individual datum in nn.Module
microservices,In pub-sub pattern can I track msg completion
machine-learning,Detect semantic information related to actual visits from text
algorithm,Fastest way to find 4-connected regions
operating-system,Does it make sense to run more PHP-FPM children than number of CPU cores?
microservices,Is there a distributed approach for buffering API requests?
operating-system,edit operating system directory file
algorithm,Toggling checkboxes using recursion | Recursion problem
operating-system,How can I remove the focus rectangle around file icons on windows 11?
database,VB.NET MySQL Connection (DB not local)
algorithm,search for suitable algorithms for the space minimization problem
microservices,Spring Boot Change RabbitListener queue name with RefreshScope Annotation
iot,IoT EDGE Device Connection state monitoring
database,What&#39;s the impact of having a partition column different from the column used for HASH distribution in Azure Synapse?
machine-learning,"How to calculate &#39;entropy&#39;, &#39;Fast Wavelet Transform&#39;, &#39;Mean crossing rate&#39; and Pearson&#39;s correlation coefficient?"
algorithm,Find number of 1&#39;s in binary representation of fibonacci(1) to fibonacci(N)
algorithm,Finding a string of length 6 in a 6^26 array of strings
algorithm,Ruby find format of aesthetically pleasant pattern of trees in a forest - challenge question
iot,How to post to a MS-teams webhook from Esp8266?
iot,Not able to send sms on gsm module(SIM7600CE) connected with Rpi4
iot,Trouble pinging LTE-device using IPv6
database,Can you use Azure Active Directory as a credential for Elastic Queries for Azure Databases?
database,Yii2 using ArrayHelper with another database
database,How to delete the multiple columns from the SQL table in SQlite3?
operating-system,Changing file permissions in inodes while a user has the file open
database,"Azure PostgreSql Connection FATAL: no pg_hba.conf entry for host &quot;xx.xx.xx.xx&quot;, user &quot;xyz&quot;, database &quot;xyz&quot;, SSL on"
algorithm,Find simplest regular expression matching all given strings
machine-learning,How to make a signal graph on matlab with given data?
operating-system,Deleting files/folders older than one hour in python
iot,Connection lost after a few minutes later in react native
security,How to add AndroidDebugKey to the Google Cloud API Key Restriction
microservices,Spring Boot Change RabbitListener queue name with RefreshScope Annotation
machine-learning,Deploying the Machine Learning Model in React Native
algorithm,How to match a regular expression against another regular expression in javascript?
web,Create typescript extension for array of particular class type
microservices,Is it a good idea to use NPM to upload some packages of a commercial project on it?
security,Does a *.example.com for a content security policy header also match example.com?
microservices,Can we share the same database but different tables between micro services
security,Anti XSS and Classic ASP
web,JavaScript: Load Images in a div after clicking a button
microservices,Spring boot application throws OutofMemory Exception when downloading large file(more than 100 mb) even though allocated memory is 1 gb
microservices,How to build integration platform
algorithm,What is the algorithm behind Snapseeds &quot;healing&quot; tool?
operating-system,How does this fork() function work in this program
algorithm,Merge two sorted streams in limited result buffer
iot,Should I include the IIoT as an secondary actor in my use case diagram?
iot,Reading IR photo sensor using pi and .net
database,java.sql.SQLIntegrityConstraintViolationException: Duplicate entry &#39;null&#39; for key &#39;login.PRIMARY&#39;
operating-system,About Idle tasks in operating systems
microservices,Managing cross DB queries in microservices
operating-system,Is there a way to remove text from path in makefile
operating-system,How can I save images with different name on different directory using PIL .save?
machine-learning,How to solve gpu compatibility error in jupyter notebook
security,How to create web link that downloads exe file with password verification
iot,How to use ssl/tls in paho mqtt using python? I got certificate verify failed
security,Firebase Admin SDK security best practice for push-notifications
operating-system,How to make pandas and csv work on linux?
microservices,Use single profile-specific property file from multiple application.properties files
algorithm,How can I turn a floating point number into the closest fraction represented by a byte numerator and denominator?
web,Webpage not scrolling in android mobile (HTML/CSS/JS)
web,AngularJS code working on pc but not on tablet
operating-system,What is technically happening in the OS when a device is lagging and inputs from peripherals are deferred?
machine-learning,tensorflow.python.framework.errors_impl.InternalError: Unsupported object type int
database,Access form cannot access previous form variable
operating-system,Is a schedulable unit of CPU time slice process or thread?
security,Calculate time it takes to reach a certain game score
iot,esp32 http_server html how to show image from sd card
security,How are the values of stored firefox credit cards encrypted? And how does one decrypt those?
security,Should I hash the password before sending it to the server side?
web,Windows - Create shortcut that C&amp;P selected text automatically to web app Deepl
algorithm,Program to find ordered pairs of nodes in an undirected graph having exactly one bridge between each and every simple path between them?
iot,Raspi / Problem running script to toggle GPIO over web with a webpage
machine-learning,Need help interpreting clusplot() graph for kmeans data analysis
algorithm,Check std::vector has duplicates
algorithm,Find all combinations of an array and get top k sum elements
algorithm,(LeetCode question: 139. Word Break) Java Solution Timeout -- Backtracking Solution
algorithm,"how to set coordinates (x,y) for each id inside the tree"
algorithm,Algorithm for efficiently drawing trees?
database,Django: unknown database name
operating-system,Why does OS know it&#39;s time to enter ACPI mode
iot,csv file exported from TDengine database cannot be reimported
web,Why can&#39;t I access my website from the internet after setting the firewall rules and port forwarding
operating-system,How to only list symlinks when walking through directory in Python?
database,How do I update votes from different radio buttons?
security,Sending vital security values to my github
database,How to delete/clear records of a particular column in a table
algorithm,Finding the longest substring in a suffix trie in linear time
web,How can I have a split background that is not 50 /50?
algorithm,How to get the aggregation of an array in javascript
web,How to Upload Pictures to Be Saved For Later
operating-system,Running script at startup with python
operating-system,make: No rule to make target 
machine-learning,the weights in Logistic Regression
machine-learning,"IndexError: only integers, slices (`:`), ellipsis (`...`), numpy.newaxis (`None`) and integer or boolean arrays are valid indices on streamlit"
web,Is there a way to disable all browsers exept Firefox in Javascript
algorithm,How do I return all possible triplets in the 3Sum problem?
operating-system,how to solve Pintos project2 userprogram intrcontext error?
microservices,Integration of graphql microservices using feign client
iot,How can I programmatically trigger an Alexa Skill intent?
algorithm,Given a binary tree find all root-to-leaf paths
iot,multiple timestamps in json body
machine-learning,Compute `predict_proba` from a OneVsOneClassifier
database,SELECT query working on every column except &quot;title&quot;
database,How can I create a local database inside a Microsoft Visual C++ 2010 Express project?
web,How to open link in new tab in same group in chrome from code?
operating-system,Loading global descriptor table causes error
machine-learning,"Image classification with CNN, very different number of images"
security,AWS Linux 2 systemd vulnerability
machine-learning,"How to use an ML model trained in Python, in a CPP based simulator?"
security,What are the best practices to securely store/access SaaS customer data on Amazon S3?
microservices,Cofigure FeignClient When Target Application is configured with server.servlet.context-path
algorithm,Deconflict constrained N team schedule
security,How to handle public API Keys?
security,How many requests can i make to google.com from same IP without getting blocked or something like that?
database,Why increasing the expiry of keys would reclaim expired keys memory faster in Redis?
algorithm,Largest sum of upper-left quadrant of matrix that can be formed by reversing rows and columns
database,ODBCconf - Setting login &amp; default database values
web,website NTLM authentication and authorization
machine-learning,how to solve Customer Product problem in NLP
machine-learning,Find closest item from ALS model using KNN
web,Why Angular doesn&#39;t show errors on screen?
machine-learning,"ValueError: Cannot assign to variable level1/kernel:0 due to variable shape (9, 9, 3, 64) and value shape (9, 9, 64, 3) are incompatible"
web,How can I use browser to open this link
iot,How can i automatically capture photos from an IOT camera in mobile app?
microservices,SAGA architecture model
machine-learning,Unable to get functionality of python application build in flask on locla host
machine-learning,Why do my model gives always same outputs for different inputs?
iot,Unable to connect to test.mosquitto.org for testing
algorithm,How to make the checking more robust and shorter?
microservices,how to solve feign.RetryableException: connect timed out executing
database,How to handle null foreign key in database table?
operating-system,How to fix signal handler functions are never invoked in c?
web,static page to display query parameter values with least security concern?
web,access database - list of parts - query a website for prices?
database,How do i make forms from html select data from database
operating-system,How virtualization helps programmers?
security,Open device password change programmatically android
iot,Why does the new version of the Top Display LCD screen IST3020-TX display jumbled pixels?
security,What&#39;s alternative of eval function in PHP
algorithm,Time complexity of longest palindrome finding algorithm
algorithm,(LeetCode question: 139. Word Break) Java Solution Timeout -- Backtracking Solution
web,Url path not changing when navigating back to previous page in flutter web
database,Can&#39;t delete an item from list view and the SQLLITE database that have custom adapter
operating-system,How can I share file in Ubuntu and windows?
web,Pass field name as parameter to custom validation method Rails 4
security,How getSession is called when is called from getServerSideProps?
microservices,Register Dockerized microservice to Eureka server - Springboot
microservices,API for service-to-service communication in Kubernetes
operating-system,Fedora/Linux unintended auto reboot after inactivity
security,"Would it be possible to isolate software from the OS system, to protect against memory dumping using virtualization or another method??"
web,Selenium Cant Access Page Error 1020 On VFS Global
machine-learning,Program for extracting terms from a text
algorithm,How to change the numbers in a string in a value of a dictionary?
database,MongoServerSelectionError: connection &lt;monitor&gt; to xx.xxx.xxx.xxx:27017 closed (whitelisting IP and opening the port didn&#39;t work)
algorithm,How to find all partitions of a multiset (a set that allows duplicates)
database,Adding observations and variables to a dataset with .csv files in Stata
operating-system,Does the shell interact with the kernel or OS?
algorithm,Writing golang algorithm to generate queries based on GraphQL input filter
machine-learning,Finding Missing Values in datasets
database,"How to deal with the name referencing problems in deployed c# applications, when later if the remote database schema changes?"
machine-learning,How to stabilize NN-model for timeseries prediction
database,NLog | AllowDbNull = true is not logging Info items and just Errors
iot,Unable to save right jpg format picture taken from ESP32Cam module and it does not open in Windows
operating-system,implementing binary semaphore using test and set
microservices,microservices: async api feedback
web,how can i solve http error on 3000 8080 port
database,Submit data into table based on certain input field in HTML form
database,How to backup sqlite database?
algorithm,Java : Binary tree Root to Leaf path with Minimum sum
algorithm,Why does this code work and why do we have to increment index twice?
microservices,@Bean with @Refreshscope is only being entered after I hit an endpoint?
database,Neo4j - How to use createRelationshipIndex / createNodeIndex in full-text search
security,Secure flag in heroku
iot,Thingsboard Upload Converter with multiple timestamps
algorithm,Remove nodes with dead end from path taken by Depth first search
machine-learning,May be someone knows where can I find the source code of &quot;Object Tracking and Mapping the coordinates to map&quot;
microservices,Could Postgres be causing AKS CPU spike to 100%?
machine-learning,Errors in training data using sklearn
machine-learning,Cross-Validation with different train and dev/test distributions
web,ThreeJS convert location on HTML to 3D space
operating-system,Python3. How to save downloaded webpages to a specified dir?
algorithm,What algorithm can I use to &quot;normalize&quot; an array of objects in WYSIWYG editor?
iot,GATEWAY : receiving data with LORA and sending with GPRS to a server
web,"Customizing already built design system src code once, and use it in many projects"
machine-learning,training datasets using pytorch MNIST &amp; CIFAR-10 sets
security,Secure management of local counter on Android
database,Merge ~100 table data into single result
database,Obtaining nodes based on several relationships
iot,send a http request vb6 button click event
web,Owasp Mantra needs downloading again to open
microservices,Getting null values while reading application.yaml file in java
microservices,Want to know about different backend lanuage and it uses?
microservices,event driven architecture best scenario
web,HTML / CSS Dropdown Menu
database,Use MongoDB with Flutter?
web,URLs and HTTP protocol
machine-learning,How is possible for the accuracy to go down as the precision and recall go up?
database,Unresolved function or method connect() mongoose
database,How to sum up time field in SQL Server
operating-system,Does a system call involve a context switch or not?
operating-system,save and search fingerprint in database using external scanner
iot,Retrieve metadata of Kura components/drivers
machine-learning,Image pre-processing steps for creating a CNN
web,Why is background color not changing for navbar on scrolling?
iot,No output when one side of UNION is empty
web,"How could i avoid receiving hyperlinks about cookie policy, and get an actual hyperlink to a page with answers?"
database,How to update SQL Server database using Datagridview binding source C#
database,"JdbcSQLSyntaxErrorException: Table &quot;SPORTEVENT&quot; not found; SQL statement, but why?"
database,how can I filter data in a list of pandas DataFrame
security,Security &amp; Pyscript
machine-learning,MLP and model selection
algorithm,How to update Sorting Algorithm Visualization?
security,Updating Transitive Dependency in Maven Project
web,How can I retrieve the favicon of a website with XSLT or JSP?
security,CSRF protection with CORS Origin header vs. CSRF token
microservices,How is session management done in microservices in java?
security,Safe way to store mysql server credentials in flask?
machine-learning,Is there a maximum length to the fine-tuning examples we give to OpenAI&#39;s GPT-3?
iot,AWS IoT Device online/offline check
security,how to transparently wrap tcp/ip request with ssl using windows api
database,Connect IBExpert through PHP or Laravel
operating-system,ubuntu server GUI interface password doesn&#39;t work
machine-learning,Get openpose output in form of human standing and sitting position
iot,Azure Device Provisioning to Edge Device
iot,Hit a URL without opening browser in Android Studio
machine-learning,Trying to bootstrap a code block using the scikit-learn roc_auc_score
web,The each() function is deprecated. This message will be suppressed on further calls PHP 7.3
database,Reccursive include from database Entity Framework .net C#
machine-learning,Why is the Generator in my GAN not working?
microservices,How much hardware is needed to create a microservices demo architecture
iot,How should i implement tagging module with help of haystack open source library
operating-system,How does de OS know which solution to apply to a concurrency problem?
iot,Micropython POST request using socket does not send data to server
